{
  "$schema": "https://json-schema.org/draft/2020-12/schema",
  "title": "reading_listening.v1",
  "description": "Lời giải dạng 17 – Nghe hiểu điểm chính. Lời giải gốc = bản dịch tiếng Việt từng dòng lời thoại (lời thoại tiếng Nhật ở cột transcript_vi) + câu hỏi + nghĩa 4 lựa chọn, rồi (tùy khuôn) '### Thông tin' (dòng thoại then chốt Nhật + dịch) hoặc '### Đáp án … Vì …'. Ánh xạ: full_translation[0].lines = từng lượt thoại {speaker, ja, meaning.vi}; question {ja, meaning}; options[i] {option_ja, reading=null, meaning, is_match, quotes=[], analysis}; key_info = dòng thoại then chốt; correct {index, option_ja, full_sentence=null}; summary = null. Chép nguyên văn, không tự viết, không sửa nội dung kể cả khi thấy sai.",
  "x-dang-bai": [
    "nghe hiểu điểm chính"
  ],
  "x-phien-ban": {
    "v1": "2026-10-08: bản sao reading_listening.v1 của explanation_schema (không thêm trường) cho dạng 17."
  },
  "type": "object",
  "additionalProperties": false,
  "properties": {
    "schema": {
      "type": "string",
      "enum": [
        "reading_listening.v1"
      ]
    },
    "question_id": {
      "type": "integer"
    },
    "cau_con": {
      "type": "integer"
    },
    "full_translation": {
      "type": [
        "array",
        "null"
      ],
      "items": {
        "type": "object",
        "additionalProperties": false,
        "properties": {
          "label": {
            "type": [
              "string",
              "null"
            ],
            "description": "A / B / null"
          },
          "lines": {
            "type": "array",
            "items": {
              "$ref": "#/$defs/Line"
            }
          }
        },
        "required": [
          "label",
          "lines"
        ]
      },
      "description": "BẢN DỊCH ĐẦY ĐỦ (hoặc lời thoại) – có thể nằm riêng trên admin"
    },
    "summary": {
      "type": [
        "array",
        "null"
      ],
      "items": {
        "type": "object",
        "additionalProperties": false,
        "properties": {
          "heading": {
            "anyOf": [
              {
                "$ref": "#/$defs/T"
              },
              {
                "type": "null"
              }
            ]
          },
          "points": {
            "type": "array",
            "items": {
              "$ref": "#/$defs/T"
            }
          }
        },
        "required": [
          "heading",
          "points"
        ]
      },
      "description": "TÓM TẮT"
    },
    "question": {
      "type": "object",
      "additionalProperties": false,
      "properties": {
        "ja": {
          "type": [
            "string",
            "null"
          ],
          "description": "Tiếng Nhật – KHÔNG dịch, copy nguyên văn"
        },
        "meaning": {
          "anyOf": [
            {
              "$ref": "#/$defs/T"
            },
            {
              "type": "null"
            }
          ]
        }
      },
      "required": [
        "ja",
        "meaning"
      ]
    },
    "options": {
      "type": "array",
      "items": {
        "type": "object",
        "additionalProperties": false,
        "properties": {
          "index": {
            "type": "integer",
            "minimum": 1,
            "maximum": 4
          },
          "option_ja": {
            "type": "string",
            "description": "Tiếng Nhật – KHÔNG dịch, copy nguyên văn"
          },
          "reading": {
            "type": [
              "string",
              "null"
            ],
            "description": "Cách đọc hiragana – KHÔNG dịch"
          },
          "meaning": {
            "anyOf": [
              {
                "$ref": "#/$defs/T"
              },
              {
                "type": "null"
              }
            ]
          },
          "is_match": {
            "type": "boolean"
          },
          "quotes": {
            "type": "array",
            "items": {
              "$ref": "#/$defs/Quote"
            }
          },
          "analysis": {
            "anyOf": [
              {
                "$ref": "#/$defs/T"
              },
              {
                "type": "null"
              }
            ]
          }
        },
        "required": [
          "index",
          "option_ja",
          "reading",
          "meaning",
          "is_match",
          "quotes",
          "analysis"
        ]
      }
    },
    "key_info": {
      "type": [
        "array",
        "null"
      ],
      "items": {
        "$ref": "#/$defs/Line"
      },
      "description": "Đoạn thoại/câu chứa đáp án (khuôn 'Thông tin')"
    },
    "correct": {
      "$ref": "#/$defs/Correct"
    }
  },
  "required": [
    "schema",
    "question_id",
    "cau_con",
    "full_translation",
    "summary",
    "question",
    "options",
    "key_info",
    "correct"
  ],
  "$defs": {
    "T": {
      "type": "object",
      "additionalProperties": false,
      "properties": {
        "vi": {
          "type": "string",
          "description": "Văn bản cần dịch. Từ/cụm tiếng Nhật không tách ra được thì bọc trong ⟪ ⟫, ví dụ: ⟪もできない⟫ mang nghĩa … Dấu { } (nếu có) đánh dấu phần gạch chân, bản dịch phải giữ đúng 1 cặp { } quanh phần tương ứng."
        }
      },
      "required": [
        "vi"
      ],
      "description": "Trường cần dịch. Bản dịch thêm khóa ngôn ngữ cùng cấp: ko, zh_tw …"
    },
    "Sentence": {
      "type": "object",
      "additionalProperties": false,
      "properties": {
        "ja": {
          "type": "string",
          "description": "Tiếng Nhật – KHÔNG dịch. Phần gạch chân/bôi đậm trong đề đặt trong { }, vd: 田中さんは{単なる}友人です。 Tối đa 1 cặp { }."
        },
        "reading": {
          "type": [
            "string",
            "null"
          ],
          "description": "Cách đọc – KHÔNG dịch. Nếu ja có { } thì đặt { } quanh cách đọc tương ứng, vd: たなかさんは{たんなる}ゆうじんです。"
        },
        "meaning": {
          "anyOf": [
            {
              "$ref": "#/$defs/T"
            },
            {
              "type": "null"
            }
          ]
        }
      },
      "required": [
        "ja",
        "reading",
        "meaning"
      ],
      "description": "Một câu tiếng Nhật + cách đọc + nghĩa. Quy tắc gạch chân: nếu ja có { } thì reading và meaning cũng phải có đúng 1 cặp { } bao phần tương ứng (vd meaning.vi: 'Anh Tanaka chỉ là một người bạn {đơn thuần}.'). Khi dịch, đặt { } quanh từ tương ứng trong bản dịch."
    },
    "Correct": {
      "type": "object",
      "additionalProperties": false,
      "properties": {
        "index": {
          "type": "integer",
          "minimum": 1,
          "maximum": 4
        },
        "option_ja": {
          "type": "string",
          "description": "Tiếng Nhật – KHÔNG dịch, copy nguyên văn"
        },
        "full_sentence": {
          "anyOf": [
            {
              "$ref": "#/$defs/Sentence"
            },
            {
              "type": "null"
            }
          ]
        }
      },
      "required": [
        "index",
        "option_ja",
        "full_sentence"
      ],
      "description": "Lựa chọn đúng (+ câu hoàn chỉnh nếu dạng bài có)"
    },
    "Term": {
      "type": "object",
      "additionalProperties": false,
      "properties": {
        "ja": {
          "type": "string",
          "description": "Tiếng Nhật – KHÔNG dịch, copy nguyên văn"
        },
        "reading": {
          "type": [
            "string",
            "null"
          ],
          "description": "Cách đọc hiragana – KHÔNG dịch"
        },
        "meaning": {
          "anyOf": [
            {
              "$ref": "#/$defs/T"
            },
            {
              "type": "null"
            }
          ]
        },
        "note": {
          "anyOf": [
            {
              "$ref": "#/$defs/T"
            },
            {
              "type": "null"
            }
          ]
        }
      },
      "required": [
        "ja",
        "reading",
        "meaning",
        "note"
      ],
      "description": "Từ/cụm tham khảo, ví dụ"
    },
    "Line": {
      "type": "object",
      "additionalProperties": false,
      "properties": {
        "speaker": {
          "type": [
            "string",
            "null"
          ],
          "description": "M / F / tên – giữ nguyên"
        },
        "ja": {
          "type": [
            "string",
            "null"
          ],
          "description": "Tiếng Nhật – KHÔNG dịch, copy nguyên văn"
        },
        "meaning": {
          "anyOf": [
            {
              "$ref": "#/$defs/T"
            },
            {
              "type": "null"
            }
          ]
        }
      },
      "required": [
        "speaker",
        "ja",
        "meaning"
      ],
      "description": "Một lượt thoại / một câu trong bài đọc"
    },
    "Quote": {
      "type": "object",
      "additionalProperties": false,
      "properties": {
        "ja": {
          "type": "string",
          "description": "Tiếng Nhật – KHÔNG dịch, copy nguyên văn"
        },
        "meaning": {
          "anyOf": [
            {
              "$ref": "#/$defs/T"
            },
            {
              "type": "null"
            }
          ]
        }
      },
      "required": [
        "ja",
        "meaning"
      ],
      "description": "Câu trích dẫn từ đoạn văn/script"
    }
  }
}