{
  "schema": "reading_listening.v1",
  "question_id": 12709,
  "cau_con": 3,
  "full_translation": null,
  "summary": null,
  "question": {
    "ja": "｜著者《ちょしゃ》は｜新聞《しんぶん》が｜衰退《すいたい》するとどうなると｜言《い》っているか。",
    "meaning": {
      "vi": "Tác giả nói điều gì sẽ xảy ra nếu báo chí suy tàn?"
    }
  },
  "options": [
    {
      "index": 1,
      "option_ja": "｜寄付《きふ》した｜人《ひと》だけがニュースを｜手《て》に｜入《い》れることができる。",
      "reading": null,
      "meaning": {
        "vi": "Chỉ những người đã quyên góp mới có thể nhận được tin tức."
      },
      "is_match": false,
      "quotes": [],
      "analysis": {
        "vi": "Đoạn văn không nói rằng chỉ những người quyên góp mới nhận được tin tức. Đoạn văn có nhắc đến việc các NPO nhận quyên góp để duy trì hoạt động, nhưng không nói rằng tin tức chỉ dành cho người quyên góp."
      }
    },
    {
      "index": 2,
      "option_ja": "ニュースが｜全《まった》く｜手《て》に｜入《い》れられなくなる。",
      "reading": null,
      "meaning": {
        "vi": "Hoàn toàn không thể nhận được tin tức."
      },
      "is_match": false,
      "quotes": [],
      "analysis": {
        "vi": "Đoạn văn không nói rằng tin tức sẽ hoàn toàn biến mất. Đoạn văn nói rằng nếu báo chí suy tàn thì chúng ta sẽ không còn phương pháp nào để biết về xã hội nữa, nhưng không khẳng định rằng không thể nhận được bất kỳ tin tức nào."
      }
    },
    {
      "index": 3,
      "option_ja": "インターネットでニュースを｜知《し》るようになる。",
      "reading": null,
      "meaning": {
        "vi": "Sẽ trở nên biết tin tức qua Internet."
      },
      "is_match": false,
      "quotes": [],
      "analysis": {
        "vi": "Đoạn văn có đề cập đến việc tỷ lệ sử dụng Internet để lấy tin tức tăng lên, nhưng câu hỏi hỏi về điều gì sẽ xảy ra nếu báo chí suy tàn, không phải là về sự thay đổi phương tiện tiếp nhận tin tức."
      }
    },
    {
      "index": 4,
      "option_ja": "｜新聞《しんぶん》だけでなく｜他《ほか》の｜報道《ほうどう》｜機関《きかん》も｜衰退《すいたい》する。",
      "reading": null,
      "meaning": {
        "vi": "Không chỉ báo chí mà các cơ quan truyền thông khác cũng sẽ suy tàn."
      },
      "is_match": true,
      "quotes": [
        {
          "ja": "｜何《なに》にせよこのまま｜新聞《しんぶん》が｜衰退《すいたい》すれば、｜報道《ほうどう》の｜危機《きき》は｜新聞《しんぶん》だけに｜留《とど》まらない。",
          "meaning": {
            "vi": "Dù sao đi chăng nữa, nếu báo chí biến mất thì khủng hoảng về tin tức sẽ không chỉ giới hạn ở báo chí."
          }
        }
      ],
      "analysis": {
        "vi": "Câu này cho thấy không chỉ báo chí mà các cơ quan truyền thông khác cũng sẽ bị ảnh hưởng, tức là cũng sẽ suy tàn."
      }
    }
  ],
  "key_info": null,
  "correct": {
    "index": 4,
    "option_ja": "｜新聞《しんぶん》だけでなく｜他《ほか》の｜報道《ほうどう》｜機関《きかん》も｜衰退《すいたい》する。",
    "full_sentence": null
  }
}